{
  "schema_version": "0.2.0",
  "mode": "audit",
  "scope": {
    "repo_root": "UNRESOLVED",
    "inspected_paths": []
  },
  "confirmed_product_truth": [],
  "unresolved_business_facts": [],
  "readiness_axes": {
    "discoverable": {
      "status": "unknown",
      "evidence": [],
      "limitations": []
    },
    "understandable": {
      "status": "unknown",
      "evidence": [],
      "limitations": []
    },
    "actionable": {
      "status": "unverified",
      "webmcp_status": "not_present",
      "evidence": [],
      "limitations": []
    }
  },
  "findings": [],
  "changed_files": [],
  "verification": [],
  "ai_visibility": {
    "status": "not_measured",
    "evidence": []
  },
  "business_outcome": {
    "status": "not_measured",
    "evidence": []
  },
  "service_escalations": [],
  "residual_risks": []
}
