{
  "schema_version": "0.2.0",
  "mode": "verify",
  "scope": {
    "repo_root": "example/beefapi",
    "inspected_paths": [
      "public pricing projection",
      "public answer routes",
      "llms and sitemap discovery"
    ]
  },
  "confirmed_product_truth": [
    "Model prices are volatile public facts derived from runtime pricing configuration.",
    "Public answers expose human-readable and machine-readable representations."
  ],
  "unresolved_business_facts": [],
  "readiness_axes": {
    "discoverable": {
      "status": "pass",
      "evidence": ["canonical HTML and machine discovery routes are reachable"],
      "limitations": []
    },
    "understandable": {
      "status": "pass",
      "evidence": ["pricing and answers reuse one versioned public snapshot"],
      "limitations": []
    },
    "actionable": {
      "status": "partial",
      "webmcp_status": "not_present",
      "evidence": ["same-origin MCP discovery, tools/list, and five representative read-only calls succeeded before WebMCP enablement"],
      "limitations": ["WebMCP registration and BrowserRun verification remain pending"]
    }
  },
  "findings": [
    {
      "id": "dynamic-price-single-source",
      "priority": "P0",
      "state": "pass",
      "evidence": ["pricing snapshot version is reused across public representations"],
      "repair": null,
      "recheck": "assert the same pricing_version across JSON and answer responses"
    }
  ],
  "changed_files": [],
  "verification": [
    {
      "check": "go test ./controller -run 'Test(GEO|CurrentGEO|BuildPublic|Public)' -count=1",
      "status": "pass"
    },
    {
      "check": "direct same-origin MCP pre-enable verification: discovery plus five representative read-only tasks",
      "status": "pass"
    },
    {
      "check": "Cloudflare BrowserRun WebMCP verification",
      "status": "not_run"
    }
  ],
  "ai_visibility": {
    "status": "not_measured",
    "evidence": []
  },
  "business_outcome": {
    "status": "not_measured",
    "evidence": []
  },
  "service_escalations": [],
  "residual_risks": [
    "Real AI platform retrieval and citation behavior requires separate repeated sampling."
  ]
}
